{
  "corpus_id": "bicameral-redaction-evaluation-v1",
  "description": "Synthetic candidate-neutral redaction evaluation corpus for the Bicameral boundary. Every value is fabricated; secret-shaped tokens are committed behind reversible byte-level obfuscation so no raw sensitive shape exists in repository bytes.",
  "records": [
    {
      "classes": [
        "positive_detection"
      ],
      "expected_path": "tests/redaction_evaluation/expected/account-id-001.json",
      "expected_sha256": "sha256:6c8cfa57219de074ed9e66e82f5656f62409e7613333db8b91ab000964612a6a",
      "input_path": "tests/redaction_evaluation/corpus/account-id-001.json",
      "input_sha256": "sha256:e9e95836c4b4111b6759250842cf9fb36f8fec18c36fcf13d6b821f2a6b5aed0",
      "record_id": "account-id-001",
      "source_shape": "plain_text"
    },
    {
      "classes": [
        "positive_detection"
      ],
      "expected_path": "tests/redaction_evaluation/expected/account-id-002.json",
      "expected_sha256": "sha256:f0aee9bfda3aab025cf331cfbea71adedd5c0d98d14fef6c1f881a240ce256a0",
      "input_path": "tests/redaction_evaluation/corpus/account-id-002.json",
      "input_sha256": "sha256:2b5bf1af7ecb09bc1e68ee40be28ab7d6b73ab4084681740c531062ee61fd6b0",
      "record_id": "account-id-002",
      "source_shape": "plain_text"
    },
    {
      "classes": [
        "positive_detection"
      ],
      "expected_path": "tests/redaction_evaluation/expected/address-billing-003.json",
      "expected_sha256": "sha256:15ee5074a81f690ca74a0536d1044bfcadf610d58d0a6434cedd448abc2444aa",
      "input_path": "tests/redaction_evaluation/corpus/address-billing-003.json",
      "input_sha256": "sha256:8f357ce628aefeff314a07c7c6eca34c69dd1d27a5039ed4fbf6b1b4634709c0",
      "record_id": "address-billing-003",
      "source_shape": "plain_text"
    },
    {
      "classes": [
        "positive_detection"
      ],
      "expected_path": "tests/redaction_evaluation/expected/address-postal-002.json",
      "expected_sha256": "sha256:c5c4370df9c9041507109072167e07f8eef429055a12b8a4e1b2d7f1c0f63e84",
      "input_path": "tests/redaction_evaluation/corpus/address-postal-002.json",
      "input_sha256": "sha256:f9c805c3120c68af8c7d80ef64244d5cd1655928f16678b1ea01b9467d09ee2d",
      "record_id": "address-postal-002",
      "source_shape": "plain_text"
    },
    {
      "classes": [
        "positive_detection"
      ],
      "expected_path": "tests/redaction_evaluation/expected/address-street-001.json",
      "expected_sha256": "sha256:74f40f487a86d60eddddb2cb31b4c8ec50afe6b0ccc6559f6a6c41ed9f1eaa53",
      "input_path": "tests/redaction_evaluation/corpus/address-street-001.json",
      "input_sha256": "sha256:5ebf74152457d21c61ab086d849a79b123be738867943b77801b8c6e45eb7233",
      "record_id": "address-street-001",
      "source_shape": "plain_text"
    },
    {
      "classes": [
        "backend_crash"
      ],
      "expected_path": "tests/redaction_evaluation/expected/backend-exception.json",
      "expected_sha256": "sha256:b740aece517fa6fc0a207cc483793f110b845b73c8b27e5ac55d27e3c0419f65",
      "input_path": "tests/redaction_evaluation/corpus/backend-exception.json",
      "input_sha256": "sha256:64b09580ead28fcce4c727333fb74aff7181309d027c6049579a9911bb7a4e6f",
      "record_id": "backend-exception",
      "source_shape": "failure_fixture"
    },
    {
      "classes": [
        "backend_unavailable"
      ],
      "expected_path": "tests/redaction_evaluation/expected/backend-initialization-failure.json",
      "expected_sha256": "sha256:0ee90663ce39d0765c14e04008826c1c57528fdfe8da3dce38e0f76c2a207bea",
      "input_path": "tests/redaction_evaluation/corpus/backend-initialization-failure.json",
      "input_sha256": "sha256:8af43c1f70cb09b34683912a26c9123367a9ad354728cd552d545091189806cd",
      "record_id": "backend-initialization-failure",
      "source_shape": "failure_fixture"
    },
    {
      "classes": [
        "backend_invalid_configuration"
      ],
      "expected_path": "tests/redaction_evaluation/expected/backend-invalid-configuration.json",
      "expected_sha256": "sha256:6b34e92069eecb227ca84d023666d63fc64ea4fe42288a53ffd5ef882d99b20b",
      "input_path": "tests/redaction_evaluation/corpus/backend-invalid-configuration.json",
      "input_sha256": "sha256:5b3c18da09d7ecb2bb6b15f39e1a3fc5aa3ce0f9654de417197fa48463b57ef8",
      "record_id": "backend-invalid-configuration",
      "source_shape": "failure_fixture"
    },
    {
      "classes": [
        "backend_unavailable"
      ],
      "expected_path": "tests/redaction_evaluation/expected/backend-missing-model.json",
      "expected_sha256": "sha256:4ad1ff73b7a7a3b2b03125c89dba11775f2eeb470a9178ebdd198ba4d86a85de",
      "input_path": "tests/redaction_evaluation/corpus/backend-missing-model.json",
      "input_sha256": "sha256:ed902e41c13f520739c88511fbb1731136f5997bf38baca0d333ddf749deedea",
      "record_id": "backend-missing-model",
      "source_shape": "failure_fixture"
    },
    {
      "classes": [
        "backend_timeout"
      ],
      "expected_path": "tests/redaction_evaluation/expected/backend-timeout.json",
      "expected_sha256": "sha256:6dda687d9190ecb4371d67f7bad12dd5673eb3509c9ad062f1e07e8d1694d73f",
      "input_path": "tests/redaction_evaluation/corpus/backend-timeout.json",
      "input_sha256": "sha256:06154a927ba02901b944b18570b6e545364607584768a2deabff8b2cfe5aa5d8",
      "record_id": "backend-timeout",
      "source_shape": "failure_fixture"
    },
    {
      "classes": [
        "concurrency_timeout_storm"
      ],
      "expected_path": "tests/redaction_evaluation/expected/concurrent-timeout-storm.json",
      "expected_sha256": "sha256:a6a23a2812fc4c1653a48143693b0208b3918012d527ca9db4085388efa47dde",
      "input_path": "tests/redaction_evaluation/corpus/concurrent-timeout-storm.json",
      "input_sha256": "sha256:6963e9450e3d1d65598d7551061c28a32fa108433f6bd5b4190453a15eb1cea3",
      "record_id": "concurrent-timeout-storm",
      "source_shape": "failure_fixture"
    },
    {
      "classes": [
        "decision_preservation",
        "positive_detection"
      ],
      "expected_path": "tests/redaction_evaluation/expected/constraint-phone-001.json",
      "expected_sha256": "sha256:6c0de86b5611afe54c8b1c8ec5970619d5ac2b842adc313c44a9a221fa92d187",
      "input_path": "tests/redaction_evaluation/corpus/constraint-phone-001.json",
      "input_sha256": "sha256:d928ada818c952500905c4d69e02b19234c7d40299b6ec8cd6aa330a455b22ac",
      "record_id": "constraint-phone-001",
      "source_shape": "observation"
    },
    {
      "classes": [
        "decision_preservation",
        "positive_detection"
      ],
      "expected_path": "tests/redaction_evaluation/expected/constraint-secret-001.json",
      "expected_sha256": "sha256:897a5706d93dced736e0912aeaccc394443d65813f136bab066fb7ba24567e40",
      "input_path": "tests/redaction_evaluation/corpus/constraint-secret-001.json",
      "input_sha256": "sha256:4439d26da4222e619bf6055a127eda0cbf706bf20783e81d3c57f0ff9d4b93c8",
      "record_id": "constraint-secret-001",
      "source_shape": "observation"
    },
    {
      "classes": [
        "decision_preservation",
        "positive_detection"
      ],
      "expected_path": "tests/redaction_evaluation/expected/decision-mrn-001.json",
      "expected_sha256": "sha256:991da13034523da2a373ad7a64476f8b3a35a3cc6c506963ea68ca9faba0b757",
      "input_path": "tests/redaction_evaluation/corpus/decision-mrn-001.json",
      "input_sha256": "sha256:03e2776ed6f173f4067c2689b0ef61b3dbbfb94fcb772635436ca404fc4d0db2",
      "record_id": "decision-mrn-001",
      "source_shape": "observation"
    },
    {
      "classes": [
        "decision_preservation",
        "positive_detection"
      ],
      "expected_path": "tests/redaction_evaluation/expected/decision-person-email-001.json",
      "expected_sha256": "sha256:a3eb306153f6fe344419277751fc175b4b109cf3202591371a85f16ecb1fa51b",
      "input_path": "tests/redaction_evaluation/corpus/decision-person-email-001.json",
      "input_sha256": "sha256:0427bc964a6c6a1d712ea61d5aec1f91a2964a3311755d9e2bc9d96588360c96",
      "record_id": "decision-person-email-001",
      "source_shape": "observation"
    },
    {
      "classes": [
        "nested_metadata",
        "positive_detection"
      ],
      "expected_path": "tests/redaction_evaluation/expected/deeply-nested-metadata-64.json",
      "expected_sha256": "sha256:57c3f28ee4ad43fb7a4882c2748291bdc1612d16d505bb011ff3e8cc2ea70b4b",
      "input_path": "tests/redaction_evaluation/corpus/deeply-nested-metadata-64.json",
      "input_sha256": "sha256:097f0e1a4fa99db0b775c174b7efb2bdeea45466243dd69ce21dd291243db9dd",
      "record_id": "deeply-nested-metadata-64",
      "source_shape": "failure_fixture"
    },
    {
      "classes": [
        "positive_detection"
      ],
      "expected_path": "tests/redaction_evaluation/expected/dob-prose-001.json",
      "expected_sha256": "sha256:f3fc0984dfc43cffeef78949b69cb2010ad15b9dc6b3cba8b93662ad6118114a",
      "input_path": "tests/redaction_evaluation/corpus/dob-prose-001.json",
      "input_sha256": "sha256:91e4e4c76bf892ff2297ddd964bcab1a0b8f945cb01f6235a3904c6d19145a1a",
      "record_id": "dob-prose-001",
      "source_shape": "plain_text"
    },
    {
      "classes": [
        "positive_detection"
      ],
      "expected_path": "tests/redaction_evaluation/expected/dob-prose-002.json",
      "expected_sha256": "sha256:911f7bfcdb4aa22ea0cad1561c6c9fac669917ee1538b92a4982bb84e5543f42",
      "input_path": "tests/redaction_evaluation/corpus/dob-prose-002.json",
      "input_sha256": "sha256:4fccc6b1d587637b0a0511e1396170ec9a7682fa17655635314ff18728f7616e",
      "record_id": "dob-prose-002",
      "source_shape": "plain_text"
    },
    {
      "classes": [
        "positive_detection"
      ],
      "expected_path": "tests/redaction_evaluation/expected/email-plain-001.json",